{
  "purposeStatement": {
    "nl": "Uitgifte",
    "en": "Issuance"
  },
  "retentionPolicy": {
    "intentToRetain": true,
    "maxDurationInMinutes": 525600
  },
  "sharingPolicy": {
    "intentToShare": false
  },
  "deletionPolicy": {
    "deleteable": false
  },
  "organization": {
    "displayName": {
      "nl": "DroomWoon",
      "en": "DreamHome"
    },
    "legalName": {
      "nl": "DroomWoon N.V.",
      "en": "DroomWoon N.V."
    },
    "description": {
      "nl": "DroomWoon is een voorbeeld-woningcorporatie.",
      "en": "DreamHome is an exemplar housing company."
    },
    "webUrl": "https://housingcompany.example.com",
    "city": {
      "nl": "Den Haag",
      "en": "The Hague"
    },
    "category": {
      "nl": "Woningcorporatie",
      "en": "Housing company"
    },
    "logo": {
      "mimeType": "image/svg+xml",
      "imageData": "<svg xmlns=\"http://www.w3.org/2000/svg\" x=\"0px\" y=\"0px\" width=\"100\" height=\"100\" viewBox=\"0 0 48 48\"><rect width=\"48\" height=\"48\" y=\"-.002\" fill=\"#87CEFA\" rx=\"6\"/><path fill=\"#E8EAF6\" d=\"M42 39L6 39 6 23 24 6 42 23z\"></path><path fill=\"#C5CAE9\" d=\"M39 21L34 16 34 9 39 9zM6 39H42V44H6z\"></path><path fill=\"#B71C1C\" d=\"M24 4.3L4 22.9 6 25.1 24 8.4 42 25.1 44 22.9z\"></path><path fill=\"#D84315\" d=\"M18 28H30V44H18z\"></path><path fill=\"#01579B\" d=\"M21 17H27V23H21z\"></path><path fill=\"#FF8A65\" d=\"M27.5,35.5c-0.3,0-0.5,0.2-0.5,0.5v2c0,0.3,0.2,0.5,0.5,0.5S28,38.3,28,38v-2C28,35.7,27.8,35.5,27.5,35.5z\"></path></svg>"
    },
    "countryCode": "nl",
    "kvk": "99876545",
    "privacyPolicyUrl": "https://housingcompany.example.com/privacy"
  },
  "requestOriginBaseUrl": "https://housingcompany.example.com",
  "authorizedAttributes": {
    "urn:eudi:pid:nl:1": [["urn:eudi:pid:nl:1", "bsn"]]
  }
}
